{
  "failure_classification": "validation failure",
  "suspected_failure_point": "model validation during API request processing",
  "likely_causes": [
    {
      "cause": "Required attribute missing from request payload",
      "confidence": "high"
    },
    {
      "cause": "Conditional validation triggered by new business logic",
      "confidence": "medium"
    }
  ],
  "missing_information": [
    "Exact validation error messages",
    "Request payload sent by client",
    "Relevant model validations"
  ],
  "next_steps": [
    "Reproduce request using curl with full payload",
    "Inspect model.errors in Rails console",
    "Compare failing payload with successful one"
  ],
  "diagnostic_suggestions": [
    "Log validation errors before rendering response",
    "Temporarily include validation errors in API response for debugging"
  ]
}

